Id,Layer,Path,CreatedDate,CreatedUser,CreatedUserId,ModifiedDate,ModifiedUser,ModifiedUserId,Title,Description,tendonvi,diachi,vitri,dienthoai,quanhuyen,phuongxa,RLongitude,RLatitude
02914274-51c8-423b-9158-52f58f066fc9,ICTHCM_EDU_THCS,/root/vdms/tangthu/data/gisp/icthcm/customdata/icthcm_edu_thcs/ca93d770-5dea-453f-a89a-d8487c6c0aca,2022-08-08T15:36:07.000Z,admin,2,2022-08-08T15:36:07.000Z,admin,2,Trường Trung Học Cơ Sở Cửu Long,hcm_thcs.xlsx,Trường Trung Học Cơ Sở Cửu Long,2 Đường Võ Duy Ninh,"{""type"":""Point"",""coordinates"":[106.714485,10.791585]}",38991232,Quận Bình Thạnh,Phường 22,106.714485,10.791585
ba43012c-0542-48c5-b35c-acf33fe57af1,ICTHCM_EDU_THCS,/root/vdms/tangthu/data/gisp/icthcm/customdata/icthcm_edu_thcs/a93f571b-9894-4fa3-99c5-96bc96e5ae3a,2022-08-08T15:36:08.000Z,admin,2,2022-08-08T15:36:08.000Z,admin,2,Trường Trung Học Cơ Sở Đặng Công Bỉnh,hcm_thcs.xlsx,Trường Trung Học Cơ Sở Đặng Công Bỉnh,Đường Bùi Công Trừng,"{""type"":""Point"",""coordinates"":[106.686682,10.904429]}",,Huyện Hóc Môn,Xã Nhị Bình,106.686682,10.904429
a5916683-9089-4e25-ab72-f71b9d8e2620,ICTHCM_EDU_THCS,/root/vdms/tangthu/data/gisp/icthcm/customdata/icthcm_edu_thcs/7c1d9d43-b9b7-4ad2-bd3a-16c230012d15,2022-08-08T15:36:09.000Z,admin,2,2022-08-08T15:36:09.000Z,admin,2,Trường Trung Học Cơ Sở Đào Duy Anh,hcm_thcs.xlsx,Trường Trung Học Cơ Sở Đào Duy Anh,14 Đường Lê Quý Đôn,"{""type"":""Point"",""coordinates"":[106.679878,10.791664]}",,Quận Phú Nhuận,Phường 11,106.679878,10.791664
41057a99-0459-4ac6-b378-368e0051741f,ICTHCM_EDU_THCS,/root/vdms/tangthu/data/gisp/icthcm/customdata/icthcm_edu_thcs/fbea4d3b-a294-4258-ae96-734dd98cd1bb,2022-08-08T15:36:09.000Z,admin,2,2022-08-08T15:36:09.000Z,admin,2,Trường Trung Học Cơ Sở Đoàn Thị Điểm,hcm_thcs.xlsx,Trường Trung Học Cơ Sở Đoàn Thị Điểm,413/8 Đường Lê Văn Sỹ,"{""type"":""Point"",""coordinates"":[106.675566,10.787443]}",3938025,Quận 3,Phường 12,106.675566,10.787443
78ff37c0-2515-4029-848b-65c15bde9f89,ICTHCM_EDU_THCS,/root/vdms/tangthu/data/gisp/icthcm/customdata/icthcm_edu_thcs/8da263a5-936a-4b7d-a5ed-248841552d4e,2022-08-08T15:36:26.000Z,admin,2,2022-08-08T15:36:26.000Z,admin,2,Trường Trung Học Cơ Sở Hai Bà Trưng,hcm_thcs.xlsx,Trường Trung Học Cơ Sở Hai Bà Trưng,295 Đường Hai Bà Trưng,"{""type"":""Point"",""coordinates"":[106.690515,10.788961]}",,Quận 3,Phường Võ Thị Sáu,106.690515,10.788961
410f65b0-b9be-4aa5-a16e-61a41897c82f,ICTHCM_EDU_THCS,/root/vdms/tangthu/data/gisp/icthcm/customdata/icthcm_edu_thcs/f6581b9d-9985-4f1a-aee6-e5616f99623d,2022-08-08T15:06:57.000Z,admin,2,2022-08-08T15:06:57.000Z,admin,2,Trường Trung Học Cơ Sở - Trung Học Phổ Thông Diên Hồng,hcm_thcs.xlsx,Trường Trung Học Cơ Sở - Trung Học Phổ Thông Diên Hồng,11 Đường Thành Thái,"{""type"":""Point"",""coordinates"":[106.665793,10.770692]}",38649145-38653493,Quận 10,Phường 14,106.665793,10.770692
2210dd1e-6f37-4edd-b413-e23663226576,ICTHCM_EDU_THCS,/root/vdms/tangthu/data/gisp/icthcm/customdata/icthcm_edu_thcs/5b6f4708-0f1d-4317-b25f-e33bc2d3abc3,2022-08-08T15:07:55.000Z,admin,2,2022-08-08T15:07:55.000Z,admin,2,Trường Trung Học Cơ Sở - Trung Học Phổ Thông Phạm Ngũ Lão,hcm_thcs.xlsx,Trường Trung Học Cơ Sở - Trung Học Phổ Thông Phạm Ngũ Lão,29/7 Đường Lê Đức Thọ,"{""type"":""Point"",""coordinates"":[106.681521,10.830969]}",38940753-0967713904-0918402997-0979990064-0974776489-0903886741,Quận Gò Vấp,Phường 7,106.681521,10.830969
3f16c279-533c-480a-9f7f-fd37f1b01282,ICTHCM_EDU_THCS,/root/vdms/tangthu/data/gisp/icthcm/customdata/icthcm_edu_thcs/ac75b98f-e26f-4cd9-b10b-ad6d6d5824e7,2022-08-08T15:07:55.000Z,admin,2,2022-08-08T15:07:55.000Z,admin,2,Trường Trung Học Cơ Sở - Trung Học Phổ Thông Phan Bội Châu,hcm_thcs.xlsx,Trường Trung Học Cơ Sở - Trung Học Phổ Thông Phan Bội Châu,47-53 (Số cũ 293-299) Đường Nguyễn Đình Chi,"{""type"":""Point"",""coordinates"":[106.640896,10.750704]}",39696827-0981777789,Quận 6,Phường 9,106.640896,10.750704
0bf4c603-f90d-4f63-ad9d-17cc8b49aca9,ICTHCM_EDU_THCS,/root/vdms/tangthu/data/gisp/icthcm/customdata/icthcm_edu_thcs/fbd4f40d-198c-4787-93cf-b5a007acd561,2022-08-08T15:09:03.000Z,admin,2,2022-08-08T15:09:03.000Z,admin,2,Trường Trung Học Cơ Sở & Trung Học Phổ Thông Bắc Sơn,hcm_thcs.xlsx,Trường Trung Học Cơ Sở & Trung Học Phổ Thông Bắc Sơn,Đường Bà Điểm 4,"{""type"":""Point"",""coordinates"":[106.588645,10.838155]}",,Huyện Hóc Môn,Xã Bà Điểm,106.588645,10.838155
cdc07ee2-955f-4fd3-8522-2b994a049533,ICTHCM_EDU_THCS,/root/vdms/tangthu/data/gisp/icthcm/customdata/icthcm_edu_thcs/ab23d17c-7504-430d-aebe-dd0500347235,2022-08-08T15:11:05.000Z,admin,2,2022-08-08T15:11:05.000Z,admin,2,Trường Trung Học Cơ Sở & Trung Học Phổ Thông Bắc Sơn,hcm_thcs.xlsx,Trường Trung Học Cơ Sở & Trung Học Phổ Thông Bắc Sơn,388/24 Đường Nguyễn Văn Quá,"{""type"":""Point"",""coordinates"":[106.629776693881,10.8350940821325]}",66524347,Quận 12,Phường Đông Hưng Thuận,106.629776693881,10.8350940821325
666e1dff-cd63-42f2-85d8-9cd9ab5b72e9,ICTHCM_EDU_THCS,/root/vdms/tangthu/data/gisp/icthcm/customdata/icthcm_edu_thcs/406cb95b-5647-4a6e-a007-e38feac1f95e,2022-08-08T15:11:07.000Z,admin,2,2022-08-08T15:11:07.000Z,admin,2,Trường Trung Học Cơ Sở An Phú Đông,hcm_thcs.xlsx,Trường Trung Học Cơ Sở An Phú Đông,2688/1A Khu Phố 1 Quốc Lộ 1A,"{""type"":""Point"",""coordinates"":[106.686833,10.860882]}",37195891,Quận 12,Phường An Phú Đông,106.686833,10.860882
b7800027-c8b2-4fe5-a406-a2ba5b7d6e8d,ICTHCM_EDU_THCS,/root/vdms/tangthu/data/gisp/icthcm/customdata/icthcm_edu_thcs/bfbdbe2f-7e85-4405-87f6-c0c8faf19d97,2022-08-08T15:12:23.000Z,admin,2,2022-08-08T15:12:23.000Z,admin,2,Trường Trung Học Cơ Sở An Phú Đông,hcm_thcs.xlsx,Trường Trung Học Cơ Sở An Phú Đông,2688/1A Khu Phố 1 Đường An Phú Đông 9,"{""type"":""Point"",""coordinates"":[106.687006,10.860012]}",37195891,Quận 12,Phường An Phú Đông,106.687006,10.860012
3631cdb5-e2c4-496d-b000-2e43a07516fc,ICTHCM_EDU_THCS,/root/vdms/tangthu/data/gisp/icthcm/customdata/icthcm_edu_thcs/6e2e886f-6215-4b1b-a969-9fb9f4b08784,2022-08-08T15:12:24.000Z,admin,2,2022-08-08T15:12:24.000Z,admin,2,Trường Trung Học Cơ Sở Bàn Cờ,hcm_thcs.xlsx,Trường Trung Học Cơ Sở Bàn Cờ,16 Cư Xá Đô Thành Đường Số 3,"{""type"":""Point"",""coordinates"":[106.682193,10.772661]}",38392848,Quận 3,Phường 4,106.682193,10.772661
b783fdc5-6366-4add-8c4b-f544855d5911,ICTHCM_EDU_THCS,/root/vdms/tangthu/data/gisp/icthcm/customdata/icthcm_edu_thcs/7c497124-7388-4013-a03a-0775aad8658a,2022-08-08T15:12:25.000Z,admin,2,2022-08-08T15:12:25.000Z,admin,2,Trường Trung Học Cơ Sở Bình An,hcm_thcs.xlsx,Trường Trung Học Cơ Sở Bình An,Đường Số 38,"{""type"":""Point"",""coordinates"":[106.726279,10.788089]}",,Thành Phố Thủ Đức,Phường An Khánh,106.726279,10.788089
9458acaf-882a-4062-9af6-865b94ce97a0,ICTHCM_EDU_THCS,/root/vdms/tangthu/data/gisp/icthcm/customdata/icthcm_edu_thcs/cab9f53b-3c7a-42b5-9989-212cd4f3b4c3,2022-08-08T15:12:25.000Z,admin,2,2022-08-08T15:12:25.000Z,admin,2,Trường Trung Học Cơ Sở Bàn Cờ (Cổng 2),hcm_thcs.xlsx,Trường Trung Học Cơ Sở Bàn Cờ (Cổng 2),Đường Số 2,"{""type"":""Point"",""coordinates"":[106.682153,10.773212]}",,Quận 3,Phường 4,106.682153,10.773212
ff2140c0-5518-401e-83f0-3ce82ec242da,ICTHCM_EDU_THCS,/root/vdms/tangthu/data/gisp/icthcm/customdata/icthcm_edu_thcs/06b3bb0b-91c8-4a0d-9aa8-72543764ac6c,2022-08-08T15:12:25.000Z,admin,2,2022-08-08T15:12:25.000Z,admin,2,Trường Trung Học Cơ Sở Bình Chánh (Cổng 3),hcm_thcs.xlsx,Trường Trung Học Cơ Sở Bình Chánh (Cổng 3),Đường Vào Trường Cấp 1-2 Bình Chánh,"{""type"":""Point"",""coordinates"":[106.564367,10.66342]}",,Huyện Bình Chánh,Xã Bình Chánh,106.564367,10.66342
548a5800-90a2-44be-b63b-5694def697ec,ICTHCM_EDU_THCS,/root/vdms/tangthu/data/gisp/icthcm/customdata/icthcm_edu_thcs/be674f40-9dfc-4a2c-9a27-b33aca2a57fa,2022-08-08T15:35:59.000Z,admin,2,2022-08-08T15:35:59.000Z,admin,2,Trường Trung Học Cơ Sở - Trung Học Phổ Thông Duy Tân,hcm_thcs.xlsx,Trường Trung Học Cơ Sở - Trung Học Phổ Thông Duy Tân,106 Đường Nguyễn Giản Thanh,"{""type"":""Point"",""coordinates"":[106.662556,10.783393]}",62997101-62997103,Quận 10,Phường 15,106.662556,10.783393
2bef0c31-5cfc-42fe-a39b-b5116723a7da,ICTHCM_EDU_THCS,/root/vdms/tangthu/data/gisp/icthcm/customdata/icthcm_edu_thcs/14d04f46-5885-4c98-9308-90846ca3c3ff,2022-08-08T15:36:02.000Z,admin,2,2022-08-08T15:36:02.000Z,admin,2,Trường Trung Học Cơ Sở An Phú,hcm_thcs.xlsx,Trường Trung Học Cơ Sở An Phú,34 Đường An Phú,"{""type"":""Point"",""coordinates"":[106.751284,10.807585]}",66850486,Thành Phố Thủ Đức,Phường An Phú,106.751284,10.807585
553c7f3b-aadb-4a5a-9e01-29ad832b5766,ICTHCM_EDU_THCS,/root/vdms/tangthu/data/gisp/icthcm/customdata/icthcm_edu_thcs/b911e2ff-b4b1-4077-8e6b-b9f2be64badd,2022-08-08T15:36:03.000Z,admin,2,2022-08-08T15:36:03.000Z,admin,2,Trường Trung Học Cơ Sở Cầu Kiệu - Cơ Cở 2,hcm_thcs.xlsx,Trường Trung Học Cơ Sở Cầu Kiệu - Cơ Cở 2,Đường Nguyễn Thị Huỳnh,"{""type"":""Point"",""coordinates"":[106.675677,10.796614]}",,Quận Phú Nhuận,Phường 8,106.675677,10.796614
21129b67-1203-46de-b47d-c44e68480ce1,ICTHCM_EDU_THCS,/root/vdms/tangthu/data/gisp/icthcm/customdata/icthcm_edu_thcs/24566bb5-00f2-4b51-b73e-16ab13b97992,2022-08-08T15:36:04.000Z,admin,2,2022-08-08T15:36:04.000Z,admin,2,Trường Trung Học Cơ Sở Chi Lăng,hcm_thcs.xlsx,Trường Trung Học Cơ Sở Chi Lăng,Đường Nguyễn Hữu Hào,"{""type"":""Point"",""coordinates"":[106.701217,10.762538]}",,Quận 4,Phường 9,106.701217,10.762538
8d18fdfc-ab25-447a-8e05-d25869db01a3,ICTHCM_EDU_THCS,/root/vdms/tangthu/data/gisp/icthcm/customdata/icthcm_edu_thcs/2b16d8d2-7cd1-47ee-8003-0abd760bc8b4,2022-08-08T15:36:11.000Z,admin,2,2022-08-08T15:36:11.000Z,admin,2,Trường Trung Học Cơ Sở Đồng Đen,hcm_thcs.xlsx,Trường Trung Học Cơ Sở Đồng Đen,F7/33 Ấp 6 Đường Quách Điêu,"{""type"":""Point"",""coordinates"":[106.57731,10.814184]}",62667001,Huyện Bình Chánh,Xã Vĩnh Lộc A,106.57731,10.814184
6782a2ca-2358-42de-9a4f-657d6f9238ac,ICTHCM_EDU_THCS,/root/vdms/tangthu/data/gisp/icthcm/customdata/icthcm_edu_thcs/d2290afc-18c6-4bc5-a6b9-f1610848ce7e,2022-08-08T15:36:11.000Z,admin,2,2022-08-08T15:36:11.000Z,admin,2,Trường Trung Học Cơ Sở Đồng Khởi,hcm_thcs.xlsx,Trường Trung Học Cơ Sở Đồng Khởi,11 Đường Phan Văn Trường,"{""type"":""Point"",""coordinates"":[106.697097,10.766031]}",8242568,Quận 1,Phường Cầu Ông Lãnh,106.697097,10.766031
bc6a970e-1954-4eb3-91bf-cdcf1590395f,ICTHCM_EDU_THCS,/root/vdms/tangthu/data/gisp/icthcm/customdata/icthcm_edu_thcs/50a30c7b-2636-4077-8857-3d4dc1cd6617,2022-08-08T15:36:11.000Z,admin,2,2022-08-08T15:36:11.000Z,admin,2,Trường Trung Học Cơ Sở Đoàn Kết,hcm_thcs.xlsx,Trường Trung Học Cơ Sở Đoàn Kết,183A Đường Tân Hòa Đông,"{""type"":""Point"",""coordinates"":[106.628695,10.758624]}",38752560,Quận 6,Phường 14,106.628695,10.758624
3bf598a4-2b4a-4c85-a983-ebfd02fb3eda,ICTHCM_EDU_THCS,/root/vdms/tangthu/data/gisp/icthcm/customdata/icthcm_edu_thcs/2c18d359-d556-46ba-b8c8-bf40ecac5e6b,2022-08-08T15:36:13.000Z,admin,2,2022-08-08T15:36:13.000Z,admin,2,Trường Trung Học Cơ Sở Hà Huy Tập,hcm_thcs.xlsx,Trường Trung Học Cơ Sở Hà Huy Tập,7 Đường Phan Đăng Lưu,"{""type"":""Point"",""coordinates"":[106.694149,10.802819]}",38412699,Quận Bình Thạnh,Phường 3,106.694149,10.802819
4e39156e-b8e0-4ad9-bff2-969de16e6195,ICTHCM_EDU_THCS,/root/vdms/tangthu/data/gisp/icthcm/customdata/icthcm_edu_thcs/dbd07db9-0f7e-49bc-b83e-865df75567f5,2022-08-08T15:36:14.000Z,admin,2,2022-08-08T15:36:14.000Z,admin,2,Trường Trung Học Cơ Sở Cách Mạng Tháng Tám,hcm_thcs.xlsx,Trường Trung Học Cơ Sở Cách Mạng Tháng Tám,285/36 Đường Cách Mạng Tháng Tám,"{""type"":""Point"",""coordinates"":[106.678633,10.778069]}",38641985 - 38629429,Quận 10,Phường 12,106.678633,10.778069
1aad3fa6-1b5e-40dd-a3b4-66e71c371ca0,ICTHCM_EDU_THCS,/root/vdms/tangthu/data/gisp/icthcm/customdata/icthcm_edu_thcs/03609a2c-4470-457c-b66e-e85f5ff13d39,2022-08-08T15:36:16.000Z,admin,2,2022-08-08T15:36:16.000Z,admin,2,Trường Trung Học Cơ Sở Hoa Sen,hcm_thcs.xlsx,Trường Trung Học Cơ Sở Hoa Sen,190 Đường Võ Văn Ngân,"{""type"":""Point"",""coordinates"":[106.763956,10.85071]}",,Thành Phố Thủ Đức,Phường Bình Thọ,106.763956,10.85071
cb5d3150-9052-4f4d-bac1-5226df2b32c5,ICTHCM_EDU_THCS,/root/vdms/tangthu/data/gisp/icthcm/customdata/icthcm_edu_thcs/9a3ee24f-91b9-42de-969d-3bfcf2271eb1,2022-08-08T15:36:16.000Z,admin,2,2022-08-08T15:36:16.000Z,admin,2,Trường Trung Học Cơ Sở Hoàng Diệu - Cổng Số 2,hcm_thcs.xlsx,Trường Trung Học Cơ Sở Hoàng Diệu - Cổng Số 2,Đường Hòa Bình,"{""type"":""Point"",""coordinates"":[106.634063,10.768807]}",,Quận Tân Phú,Phường Tân Thới Hòa,106.634063,10.768807
411ba8e5-65fa-4d83-bd9a-c1e3d0af5836,ICTHCM_EDU_THCS,/root/vdms/tangthu/data/gisp/icthcm/customdata/icthcm_edu_thcs/6e26e69b-494f-48ca-a6c3-a6d1e3a486ea,2022-08-08T15:36:16.000Z,admin,2,2022-08-08T15:36:16.000Z,admin,2,Trường Trung Học Cơ Sở Đông Thạnh - Cổng 1,hcm_thcs.xlsx,Trường Trung Học Cơ Sở Đông Thạnh - Cổng 1,Đường Nguyễn Thị Điệp,"{""type"":""Point"",""coordinates"":[106.624153,10.903457]}",,Huyện Hóc Môn,Xã Đông Thạnh,106.624153,10.903457
95f0089c-7f47-43e6-a313-20a1a7f00980,ICTHCM_EDU_THCS,/root/vdms/tangthu/data/gisp/icthcm/customdata/icthcm_edu_thcs/a3bc1f30-0f6e-4ad2-a27c-28cc09933727,2022-08-08T15:36:17.000Z,admin,2,2022-08-08T15:36:17.000Z,admin,2,Trường Trung Học Cơ Sở Hoàng Diệu - Cổng Số 3,hcm_thcs.xlsx,Trường Trung Học Cơ Sở Hoàng Diệu - Cổng Số 3,Đường Hòa Bình,"{""type"":""Point"",""coordinates"":[106.633337,10.768977]}",,Quận Tân Phú,Phường Tân Thới Hòa,106.633337,10.768977
a31e6c3b-7965-4a59-934b-ea7df16382c3,ICTHCM_EDU_THCS,/root/vdms/tangthu/data/gisp/icthcm/customdata/icthcm_edu_thcs/88298a02-2509-43df-83fd-d49e00118f52,2022-08-08T15:36:17.000Z,admin,2,2022-08-08T15:36:17.000Z,admin,2,Trường Trung Học Cơ Sở Đông Thạnh - Cổng 2,hcm_thcs.xlsx,Trường Trung Học Cơ Sở Đông Thạnh - Cổng 2,Đường Nguyễn Thị Điệp,"{""type"":""Point"",""coordinates"":[106.624552,10.903003]}",,Huyện Hóc Môn,Xã Đông Thạnh,106.624552,10.903003
89b18c15-47b8-46c4-a583-29d5e8b4aa4d,ICTHCM_EDU_THCS,/root/vdms/tangthu/data/gisp/icthcm/customdata/icthcm_edu_thcs/1d64a624-ace2-4ce7-b9a0-554e142126db,2022-08-08T15:36:18.000Z,admin,2,2022-08-08T15:36:18.000Z,admin,2,Trường Trung Học Cơ Sở Đông Thạnh 1,hcm_thcs.xlsx,Trường Trung Học Cơ Sở Đông Thạnh 1,Đường Đặng Thúc Vịnh,"{""type"":""Point"",""coordinates"":[106.649105,10.915563]}",,Huyện Hóc Môn,Xã Đông Thạnh,106.649105,10.915563
cc9eda65-1b57-4c72-a5f1-8ea5082066d0,ICTHCM_EDU_THCS,/root/vdms/tangthu/data/gisp/icthcm/customdata/icthcm_edu_thcs/feb1e67f-2c5b-4f81-a53e-d005e99145cd,2022-08-08T15:36:18.000Z,admin,2,2022-08-08T15:36:18.000Z,admin,2,Trường Trung Học Cơ Sở Bình Lợi Trung - Cổng 3,hcm_thcs.xlsx,Trường Trung Học Cơ Sở Bình Lợi Trung - Cổng 3,Đường Trục,"{""type"":""Point"",""coordinates"":[106.700695,10.830206]}",,Quận Bình Thạnh,Phường 13,106.700695,10.830206
a95df5ea-880e-4662-aa3e-d12088c45c16,ICTHCM_EDU_THCS,/root/vdms/tangthu/data/gisp/icthcm/customdata/icthcm_edu_thcs/bf0baf5b-7d30-4b80-99fb-50cbd82b99ef,2022-08-08T15:36:18.000Z,admin,2,2022-08-08T15:36:18.000Z,admin,2,Trường Trung Học Cơ Sở Đức Trí,hcm_thcs.xlsx,Trường Trung Học Cơ Sở Đức Trí,273 Đường Nguyễn Trãi,"{""type"":""Point"",""coordinates"":[106.687158,10.763518]}",38324284,Quận 1,Phường Nguyễn Cư Trinh,106.687158,10.763518
2c2368fb-cd9c-4479-834b-e059f3c46b53,ICTHCM_EDU_THCS,/root/vdms/tangthu/data/gisp/icthcm/customdata/icthcm_edu_thcs/91520283-2fe7-441d-9d55-4a22844e27a1,2022-08-08T15:36:18.000Z,admin,2,2022-08-08T15:36:18.000Z,admin,2,Trường Trung Học Cơ Sở Hoàng Văn Thụ,hcm_thcs.xlsx,Trường Trung Học Cơ Sở Hoàng Văn Thụ,322 Đường Nguyễn Tri Phương,"{""type"":""Point"",""coordinates"":[106.668231,10.763116]}",39270540,Quận 10,Phường 4,106.668231,10.763116
65b8dfb8-dfb7-4f84-9e13-e8a51723857b,ICTHCM_EDU_THCS,/root/vdms/tangthu/data/gisp/icthcm/customdata/icthcm_edu_thcs/362225db-3de9-46c5-bdf2-b21e73b9e6ed,2022-08-08T15:36:19.000Z,admin,2,2022-08-08T15:36:19.000Z,admin,2,Trường Trung Học Cơ Sở Hưng Bình,hcm_thcs.xlsx,Trường Trung Học Cơ Sở Hưng Bình,Đường Số 30,"{""type"":""Point"",""coordinates"":[106.830478,10.850591]}",,Thành Phố Thủ Đức,Phường Long Thạnh Mỹ,106.830478,10.850591
d26484aa-ad44-4c5a-ba64-ee5f406d80c3,ICTHCM_EDU_THCS,/root/vdms/tangthu/data/gisp/icthcm/customdata/icthcm_edu_thcs/52b45596-409f-47c9-b81f-a8c2d13dca79,2022-08-08T15:36:20.000Z,admin,2,2022-08-08T15:36:20.000Z,admin,2,Trường Trung Học Cơ Sở Hùng Vương,hcm_thcs.xlsx,Trường Trung Học Cơ Sở Hùng Vương,20F Đường Lương Minh Nguyệt,"{""type"":""Point"",""coordinates"":[106.631362,10.761011]}",39612249,Quận Tân Phú,Phường Tân Thới Hòa,106.631362,10.761011
a6502eec-e7d8-4b4c-b12e-73907b0f66b1,ICTHCM_EDU_THCS,/root/vdms/tangthu/data/gisp/icthcm/customdata/icthcm_edu_thcs/c80272a4-af24-49bd-8b13-c7ea8d07287e,2022-08-08T15:36:25.000Z,admin,2,2022-08-08T15:36:25.000Z,admin,2,Trường Trung Học Cơ Sở Lê Quý Đôn,hcm_thcs.xlsx,Trường Trung Học Cơ Sở Lê Quý Đôn,343D Đường Nguyễn Văn Phú,"{""type"":""Point"",""coordinates"":[106.641697,10.768888]}",,Quận 11,Phường 5,106.641697,10.768888
01ea4cde-b754-49e9-962f-887a1316df11,ICTHCM_EDU_THCS,/root/vdms/tangthu/data/gisp/icthcm/customdata/icthcm_edu_thcs/185c4c12-5460-45cf-a235-2f42f58feeff,2022-08-08T15:06:56.000Z,admin,2,2022-08-08T15:06:56.000Z,admin,2,Trường Trung Học - Trung Học Cơ Sở Và Trung Học Phổ Thông Quốc Văn Sài Gòn,hcm_thcs.xlsx,Trường Trung Học - Trung Học Cơ Sở Và Trung Học Phổ Thông Quốc Văn Sài Gòn,300 Đường Hòa Bình,"{""type"":""Point"",""coordinates"":[106.623923,10.772968]}",39760721,Quận Tân Phú,Phường Hiệp Tân,106.623923,10.772968
e0c5f71f-340e-45b2-9734-122fd91feb0a,ICTHCM_EDU_THCS,/root/vdms/tangthu/data/gisp/icthcm/customdata/icthcm_edu_thcs/83bc4149-7922-4f96-a6dd-9e437fe7382b,2022-08-08T15:06:56.000Z,admin,2,2022-08-08T15:06:56.000Z,admin,2,Trường Trung Học Cơ Sở - Nguyễn Văn Trỗi,hcm_thcs.xlsx,Trường Trung Học Cơ Sở - Nguyễn Văn Trỗi,Đường Số 48,"{""type"":""Point"",""coordinates"":[106.773347371337,10.78978082399]}",,Thành Phố Thủ Đức,Phường Bình Trưng Đông,106.773347371337,10.78978082399
f8df0d82-a881-4136-a926-deb1ea504e7e,ICTHCM_EDU_THCS,/root/vdms/tangthu/data/gisp/icthcm/customdata/icthcm_edu_thcs/b5ae5b4d-2dce-494d-9254-47a24e388908,2022-08-08T15:07:54.000Z,admin,2,2022-08-08T15:07:54.000Z,admin,2,Trường Trung Học Cơ Sở - Trung Học Phổ Thông Hoa Sen - Cơ Sở 2,hcm_thcs.xlsx,Trường Trung Học Cơ Sở - Trung Học Phổ Thông Hoa Sen - Cơ Sở 2,Km11+300 Xa Lộ Hà Nội,"{""type"":""Point"",""coordinates"":[106.770194023848,10.8404247256232]}",37361988,Thành Phố Thủ Đức,Phường Hiệp Phú,106.770194023848,10.8404247256232
1d0d1cd3-4792-4d7f-8aab-e9d763d6b246,ICTHCM_EDU_THCS,/root/vdms/tangthu/data/gisp/icthcm/customdata/icthcm_edu_thcs/12d2db7c-61d3-450f-9369-b2d103a61647,2022-08-08T15:09:01.000Z,admin,2,2022-08-08T15:09:01.000Z,admin,2,Trường Trung Học Cơ Sở - Trung Học Phổ Thông Sương Nguyệt Ánh,hcm_thcs.xlsx,Trường Trung Học Cơ Sở - Trung Học Phổ Thông Sương Nguyệt Ánh,249 Đường Hòa Hảo,"{""type"":""Point"",""coordinates"":[106.671162,10.762421]}",38358176,Quận 10,Phường 2,106.671162,10.762421
80d25e60-0cd2-4fd1-932f-526291c6160b,ICTHCM_EDU_THCS,/root/vdms/tangthu/data/gisp/icthcm/customdata/icthcm_edu_thcs/1a9582ab-2c99-47fc-8551-466f28ada1dd,2022-08-08T15:36:00.000Z,admin,2,2022-08-08T15:36:00.000Z,admin,2,Trường Trung Học Cơ Sở Bình Qưới Tây,hcm_thcs.xlsx,Trường Trung Học Cơ Sở Bình Qưới Tây,376A Đường Bình Qưới,"{""type"":""Point"",""coordinates"":[106.73376,10.82155]}",35565458,Quận Bình Thạnh,Phường 28,106.73376,10.82155
7d10695d-2ee3-4ace-bc35-493686cf67c3,ICTHCM_EDU_THCS,/root/vdms/tangthu/data/gisp/icthcm/customdata/icthcm_edu_thcs/61974b80-6bee-438e-a155-55e97a5cb69a,2022-08-08T15:36:01.000Z,admin,2,2022-08-08T15:36:01.000Z,admin,2,Trường Trung Học Cơ Sở Bình Hưng Hòa,hcm_thcs.xlsx,Trường Trung Học Cơ Sở Bình Hưng Hòa,Đường Tân Kỳ Tân Quý,"{""type"":""Point"",""coordinates"":[106.59974,10.791652]}",,Quận Bình Tân,Phường Bình Hưng Hòa,106.59974,10.791652
bcd1f17a-c7d0-4ea6-b3a4-4b7a063bd0a7,ICTHCM_EDU_THCS,/root/vdms/tangthu/data/gisp/icthcm/customdata/icthcm_edu_thcs/bebf8f4a-6e01-4292-a028-3c282d2c2998,2022-08-08T15:36:03.000Z,admin,2,2022-08-08T15:36:03.000Z,admin,2,Trường Trung Học Cơ Sở Cát Lái - Cổng A,hcm_thcs.xlsx,Trường Trung Học Cơ Sở Cát Lái - Cổng A,15 Đường Số 69,"{""type"":""Point"",""coordinates"":[106.791613,10.769759]}",,Thành Phố Thủ Đức,Phường Cát Lái,106.791613,10.769759
6bd4d983-f52f-4147-9355-9a8c4d237dce,ICTHCM_EDU_THCS,/root/vdms/tangthu/data/gisp/icthcm/customdata/icthcm_edu_thcs/64e268f2-0212-4f2b-bde8-9d45e2a787ab,2022-08-08T15:36:10.000Z,admin,2,2022-08-08T15:36:10.000Z,admin,2,Trường Trung Học Cơ Sở Đoàn Thị Điểm,hcm_thcs.xlsx,Trường Trung Học Cơ Sở Đoàn Thị Điểm,413/86 Đường Lê Văn Sỹ,"{""type"":""Point"",""coordinates"":[106.675435,10.789128]}",39318025,Quận 3,Phường 12,106.675435,10.789128
033b6da6-ffb6-4f13-a1cb-819d83581132,ICTHCM_EDU_THCS,/root/vdms/tangthu/data/gisp/icthcm/customdata/icthcm_edu_thcs/0e79c951-8bae-418c-8a13-7bc5901d74bd,2022-08-08T15:36:11.000Z,admin,2,2022-08-08T15:36:11.000Z,admin,2,Trường Trung Học Cơ Sở Đỗ Văn Dậy,hcm_thcs.xlsx,Trường Trung Học Cơ Sở Đỗ Văn Dậy,Đường Huỳnh Thị Mài,"{""type"":""Point"",""coordinates"":[106.583157,10.909308]}",,Huyện Hóc Môn,Xã Tân Hiệp,106.583157,10.909308
0d0ad192-f337-4443-9d3e-63211a668a85,ICTHCM_EDU_THCS,/root/vdms/tangthu/data/gisp/icthcm/customdata/icthcm_edu_thcs/dbfb0793-f471-4b9e-b478-22694b15616b,2022-08-08T15:36:18.000Z,admin,2,2022-08-08T15:36:18.000Z,admin,2,Trường Trung Học Cơ Sở Đức Trí,hcm_thcs.xlsx,Trường Trung Học Cơ Sở Đức Trí,273 Đường Nguyễn Trãi,"{""type"":""Point"",""coordinates"":[106.687357,10.763186]}",,Quận 1,Phường Nguyễn Cư Trinh,106.687357,10.763186
44f9169d-c7ff-438a-9cc5-e7e7086efbec,ICTHCM_EDU_THCS,/root/vdms/tangthu/data/gisp/icthcm/customdata/icthcm_edu_thcs/c40ba8d6-8158-47ba-ad1a-d814470df966,2022-08-08T15:36:21.000Z,admin,2,2022-08-08T15:36:21.000Z,admin,2,Trường Trung Học Cơ Sở Huỳnh Khương Ninh,hcm_thcs.xlsx,Trường Trung Học Cơ Sở Huỳnh Khương Ninh,48 Đường Phan Liêm,"{""type"":""Point"",""coordinates"":[106.694757,10.789902]}",38203901,Quận 1,Phường Đa Kao,106.694757,10.789902
113872cc-0f5b-40e8-9e6b-db1a6ed5ae5c,ICTHCM_EDU_THCS,/root/vdms/tangthu/data/gisp/icthcm/customdata/icthcm_edu_thcs/dcb69395-3e99-4603-8730-4a0bebbcb81e,2022-08-08T15:36:21.000Z,admin,2,2022-08-08T15:36:21.000Z,admin,2,Trường Trung Học Cơ Sở Khánh Hội A,hcm_thcs.xlsx,Trường Trung Học Cơ Sở Khánh Hội A,A75 Đường Nguyễn Thần Hiến,"{""type"":""Point"",""coordinates"":[106.71673,10.755241]}",,Quận 4,Phường 18,106.71673,10.755241
2176e68f-dcbd-48fa-9106-040d58131f2a,ICTHCM_EDU_THCS,/root/vdms/tangthu/data/gisp/icthcm/customdata/icthcm_edu_thcs/bf3ae5cf-a9c6-4ad4-8b11-893d1d69114f,2022-08-08T15:36:22.000Z,admin,2,2022-08-08T15:36:22.000Z,admin,2,Trường Trung Học Cơ Sở Lam Sơn,hcm_thcs.xlsx,Trường Trung Học Cơ Sở Lam Sơn,280 Đường Bùi Hữu Nghĩa,"{""type"":""Point"",""coordinates"":[106.699646,10.799536]}",38410881-38412174,Quận Bình Thạnh,Phường 2,106.699646,10.799536
ba2f5b9e-3a8d-4446-8c7d-3b0a5a738482,ICTHCM_EDU_THCS,/root/vdms/tangthu/data/gisp/icthcm/customdata/icthcm_edu_thcs/295ef7a2-329b-49a3-9456-e70043ecd36e,2022-08-08T15:36:22.000Z,admin,2,2022-08-08T15:36:22.000Z,admin,2,Trường Trung Học Cơ Sở Lam Sơn,hcm_thcs.xlsx,Trường Trung Học Cơ Sở Lam Sơn,805A Đường Hậu Giang,"{""type"":""Point"",""coordinates"":[106.63034,10.746839]}",,Quận 6,Phường 11,106.63034,10.746839
f21ba5fc-8888-4855-a7d9-215e567f6748,ICTHCM_EDU_THCS,/root/vdms/tangthu/data/gisp/icthcm/customdata/icthcm_edu_thcs/bb406eab-611f-4b00-8923-b42df2bfbaf8,2022-08-08T15:36:23.000Z,admin,2,2022-08-08T15:36:23.000Z,admin,2,Trường Trung Học Cơ Sở Huỳnh Văn Nghệ,hcm_thcs.xlsx,Trường Trung Học Cơ Sở Huỳnh Văn Nghệ,89 Đường Số 3,"{""type"":""Point"",""coordinates"":[106.592806,10.810876]}",54254567,Quận Bình Tân,Phường Bình Hưng Hòa B,106.592806,10.810876
