Id,Layer,Path,CreatedDate,CreatedUser,CreatedUserId,ModifiedDate,ModifiedUser,ModifiedUserId,Title,Description,dienthoai,diachi,thanhphoquanhuyen,phuongxa,vitritrenbando,donvi
5dfd6df6-d613-4e2e-9045-032c3b89ce42,ICTHCM_HCM_SIEUTHI,/root/vdms/tangthu/data/gisp/icthcm/customdata/icthcm_hcm_sieuthi/8d0040f0-e3ff-4ef5-88b1-c9117415a31b,2023-03-27T06:44:48.000Z,admin,2,2023-03-27T06:44:48.000Z,admin,2,B-smart,sieuthi_vdms_covid19.xlsx,,"99A Đường Huỳnh Khương An, Phường 5, Quận Gò Vấp, Thành Phố Hồ Chí Minh",Quận Gò Vấp,,"{""type"":""Point"",""coordinates"":[106.689295,10.822735]}",B-smart
73a27f7c-eaa3-4f53-88a4-cd00d47b6d58,ICTHCM_HCM_SIEUTHI,/root/vdms/tangthu/data/gisp/icthcm/customdata/icthcm_hcm_sieuthi/0ae44cc2-7100-4d83-8cf3-4a41a475a4d0,2023-03-27T06:44:50.000Z,admin,2,2023-03-27T06:44:50.000Z,admin,2,Siêu Thị Co.opmart (Cổng Lý Thường Kiệt),sieuthi_vdms_covid19.xlsx,,"Đường Lý Thường Kiệt, Phường 7, Quận 10, Thành Phố Hồ Chí Minh",Quận 10,,"{""type"":""Point"",""coordinates"":[106.661173,10.759873]}",Siêu Thị Co.opmart (Cổng Lý Thường Kiệt)
acd0ee8f-4ba2-4eaa-b2af-5546f0894450,ICTHCM_HCM_SIEUTHI,/root/vdms/tangthu/data/gisp/icthcm/customdata/icthcm_hcm_sieuthi/81236d56-6153-4a4b-902d-e65874ceee61,2023-03-27T06:45:26.000Z,admin,2,2023-03-27T06:45:26.000Z,admin,2,Siêu Thị BON Grocer,sieuthi_vdms_covid19.xlsx,,"Trung Tâm Thương Mại RomeA, 117 Đường Nguyễn Đình Chiểu, Phường 6, Quận 3, Thành Phố Hồ Chí Minh",Quận 3,,"{""type"":""Point"",""coordinates"":[106.690014,10.77832]}",Siêu Thị BON Grocer
eff7b4f6-efa9-441e-96ac-cadd7d3aa140,ICTHCM_HCM_SIEUTHI,/root/vdms/tangthu/data/gisp/icthcm/customdata/icthcm_hcm_sieuthi/fca31fde-e09f-4748-aad3-6e60c0ae2e47,2023-03-27T06:45:29.000Z,admin,2,2023-03-27T06:45:29.000Z,admin,2,Bách Hóa Xanh,sieuthi_vdms_covid19.xlsx,,"14 Đường Số 2, Phường Bình Hưng Hòa, Quận Bình Tân, Thành Phố Hồ Chí Minh",Quận Bình Tân,,"{""type"":""Point"",""coordinates"":[106.60107,10.810004]}",Bách Hóa Xanh
1669778e-0f45-4b3d-a65f-569b5bdef5b4,ICTHCM_HCM_SIEUTHI,/root/vdms/tangthu/data/gisp/icthcm/customdata/icthcm_hcm_sieuthi/25cae4d6-c11f-4519-ab0e-bdc588b2d2a1,2023-03-27T06:45:32.000Z,admin,2,2023-03-27T06:45:32.000Z,admin,2,Siêu Thị Nhật Bản,sieuthi_vdms_covid19.xlsx,,"S16-1 Sky Garden Đường Nguyễn Văn Linh, Phường Tân Phong, Quận 7, Thành Phố Hồ Chí Minh",Quận 7,,"{""type"":""Point"",""coordinates"":[106.705846,10.729199]}",Siêu Thị Nhật Bản
df4b3f04-0f8c-45d4-9116-22db82dc65b5,ICTHCM_HCM_SIEUTHI,/root/vdms/tangthu/data/gisp/icthcm/customdata/icthcm_hcm_sieuthi/a2b0c001-41c8-417e-a8f2-97fe9a0a3058,2023-03-27T06:45:33.000Z,admin,2,2023-03-27T06:45:33.000Z,admin,2,Siêu Thị Điện Máy Nội Thất Chợ Lớn,sieuthi_vdms_covid19.xlsx,,"Đường Kinh Dương Vương, Phường An Lạc, Quận Bình Tân, Thành Phố Hồ Chí Minh",Quận Bình Tân,,"{""type"":""Point"",""coordinates"":[106.60881,10.729089]}",Siêu Thị Điện Máy Nội Thất Chợ Lớn
5793d291-3113-4686-bd61-8ef9be7bde30,ICTHCM_HCM_SIEUTHI,/root/vdms/tangthu/data/gisp/icthcm/customdata/icthcm_hcm_sieuthi/e502445b-e156-445b-b18e-74b6e55ccb03,2023-03-27T06:45:33.000Z,admin,2,2023-03-27T06:45:33.000Z,admin,2,Thế Giới Di Động,sieuthi_vdms_covid19.xlsx,,"Quốc Lộ 1, Phường Tân Thới Hiệp, Quận 12, Thành Phố Hồ Chí Minh",Quận 12,,"{""type"":""Point"",""coordinates"":[106.639246,10.856685]}",Thế Giới Di Động
b37a5565-4cca-4457-addb-c2fb9b4b6e00,ICTHCM_HCM_SIEUTHI,/root/vdms/tangthu/data/gisp/icthcm/customdata/icthcm_hcm_sieuthi/fea47add-f89d-47aa-9c42-019c362e350d,2023-03-27T06:45:50.000Z,admin,2,2023-03-27T06:45:50.000Z,admin,2,Trung Tâm Mua Sắm Nam Sài Gòn,sieuthi_vdms_covid19.xlsx,,"E5/5B - E5/5C Đường Nguyễn Hữu Trí, Thị Trấn Tân Túc, Huyện Bình Chánh, Thành Phố Hồ Chí Minh",Huyện Bình Chánh,,"{""type"":""Point"",""coordinates"":[106.587815,10.695248]}",Trung Tâm Mua Sắm Nam Sài Gòn
bd3f41b8-7cc6-4d94-b836-4a2ca90dfc88,ICTHCM_HCM_SIEUTHI,/root/vdms/tangthu/data/gisp/icthcm/customdata/icthcm_hcm_sieuthi/8e0190ee-7dce-47f0-9272-4a05cd038855,2023-03-27T06:45:53.000Z,admin,2,2023-03-27T06:45:53.000Z,admin,2,Bách Hóa Xanh,sieuthi_vdms_covid19.xlsx,,"245A Đường Nguyễn Thị Tú, Phường Bình Hưng Hòa B, Quận Bình Tân, Thành Phố Hồ Chí Minh",Quận Bình Tân,,"{""type"":""Point"",""coordinates"":[106.593011,10.815479]}",Bách Hóa Xanh
a2f8ea08-dd07-4653-8139-322f778a1291,ICTHCM_HCM_SIEUTHI,/root/vdms/tangthu/data/gisp/icthcm/customdata/icthcm_hcm_sieuthi/0532791b-d93f-46e6-b63b-a33069e1b6f9,2023-03-27T06:45:56.000Z,admin,2,2023-03-27T06:45:56.000Z,admin,2,Siêu Thị Family,sieuthi_vdms_covid19.xlsx,54101123-54101125,"D1-09 Khu Phố Mỹ Toàn 3 Đường Nguyễn Văn Linh, Phường Tân Phong, Quận 7, Thành Phố Hồ Chí Minh",Quận 7,,"{""type"":""Point"",""coordinates"":[106.708033,10.729257]}",Siêu Thị Family
9f8fc0f2-2dfa-466a-a1c6-b2164518bf7c,ICTHCM_HCM_SIEUTHI,/root/vdms/tangthu/data/gisp/icthcm/customdata/icthcm_hcm_sieuthi/7b17bd47-bf31-46b0-a2c1-3f95f718028e,2023-03-27T06:45:57.000Z,admin,2,2023-03-27T06:45:57.000Z,admin,2,Co.op Food,sieuthi_vdms_covid19.xlsx,,"62 Đường số 44, Phường 10, Quận 6, Thành Phố Hồ Chí Minh",Quận 6,,"{""type"":""Point"",""coordinates"":[106.625056,10.736099]}",Co.op Food
15845085-f8d5-4ce6-b331-68670f7b7589,ICTHCM_HCM_SIEUTHI,/root/vdms/tangthu/data/gisp/icthcm/customdata/icthcm_hcm_sieuthi/5fcd1ee6-d243-4ff2-9317-d7b89adbb4bc,2023-03-27T06:46:00.000Z,admin,2,2023-03-27T06:46:00.000Z,admin,2,Siêu Thị Trang Trí Nội Thất Thái Lan - Index Living Mall,sieuthi_vdms_covid19.xlsx,,"Cao Ốc H2 Hoàng Diệu, 196 Đường Hoàng Diệu, Phường 8, Quận 4, Thành Phố Hồ Chí Minh",Quận 4,,"{""type"":""Point"",""coordinates"":[106.702166,10.762281]}",Siêu Thị Trang Trí Nội Thất Thái Lan - Index Living Mall
02e5a765-f615-4abf-a2ba-c5ff413c7683,ICTHCM_HCM_SIEUTHI,/root/vdms/tangthu/data/gisp/icthcm/customdata/icthcm_hcm_sieuthi/72ca45ff-ef45-4a75-9683-5734a7e6efc2,2023-03-27T06:46:10.000Z,admin,2,2023-03-27T06:46:10.000Z,admin,2,Siêu Thị Nội Thất Hà Nam,sieuthi_vdms_covid19.xlsx,,"126-128 Đường Nguyễn Xí, Phường 26, Quận Bình Thạnh, Thành Phố Hồ Chí Minh",Quận Bình Thạnh,,"{""type"":""Point"",""coordinates"":[106.709276,10.81366]}",Siêu Thị Nội Thất Hà Nam
484ccf28-c7d0-410b-baae-cfacffef8d6f,ICTHCM_HCM_SIEUTHI,/root/vdms/tangthu/data/gisp/icthcm/customdata/icthcm_hcm_sieuthi/cb767b35-d03d-48cc-b53c-210d26dc73c6,2023-03-27T06:46:12.000Z,admin,2,2023-03-27T06:46:12.000Z,admin,2,Bsmart,sieuthi_vdms_covid19.xlsx,,"Đường Khuôn Việt, Phường Phú Trung, Quận Tân Phú, Thành Phố Hồ Chí Minh",Quận Tân Phú,,"{""type"":""Point"",""coordinates"":[106.642232,10.780107]}",Bsmart
7fc29428-5248-4a71-8c64-fc281704d9e2,ICTHCM_HCM_SIEUTHI,/root/vdms/tangthu/data/gisp/icthcm/customdata/icthcm_hcm_sieuthi/7c7e3994-6770-4924-8abe-ec794f9bcbbc,2023-03-27T06:46:14.000Z,admin,2,2023-03-27T06:46:14.000Z,admin,2,Vinmart,sieuthi_vdms_covid19.xlsx,,"91 Đường Điện Biên Phủ, Phường Đa Kao, Quận 1, Thành Phố Hồ Chí Minh",Quận 1,,"{""type"":""Point"",""coordinates"":[106.696687,10.789432]}",Vinmart
cce60588-b11d-4bfb-84a5-78005615ae3a,ICTHCM_HCM_SIEUTHI,/root/vdms/tangthu/data/gisp/icthcm/customdata/icthcm_hcm_sieuthi/83e74f1a-c56c-41de-9dc8-47a1535e50d4,2023-03-27T06:46:25.000Z,admin,2,2023-03-27T06:46:25.000Z,admin,2,Siêu Thị Tại Gia,sieuthi_vdms_covid19.xlsx,,"733 Đường Kinh Dương Vương, Phường An Lạc, Quận Bình Tân, Thành Phố Hồ Chí Minh",Quận Bình Tân,,"{""type"":""Point"",""coordinates"":[106.607592,10.728265]}",Siêu Thị Tại Gia
435abb50-ce8b-4124-9587-578d226d123f,ICTHCM_HCM_SIEUTHI,/root/vdms/tangthu/data/gisp/icthcm/customdata/icthcm_hcm_sieuthi/6e8e9c8f-cc01-4d1f-bd2e-274925cfabaf,2023-03-27T06:46:27.000Z,admin,2,2023-03-27T06:46:27.000Z,admin,2,Siêu Thị Hando Mart,sieuthi_vdms_covid19.xlsx,37711157-37754338,"80-82 Đường Số 17, Phường Tân Kiểng, Quận 7, Thành Phố Hồ Chí Minh",Quận 7,,"{""type"":""Point"",""coordinates"":[106.71231,10.744997]}",Siêu Thị Hando Mart
1b95e5d8-6a70-4d2d-9a73-574f96d50d36,ICTHCM_HCM_SIEUTHI,/root/vdms/tangthu/data/gisp/icthcm/customdata/icthcm_hcm_sieuthi/b0a30046-7b7e-4739-ac59-e8f2927e3f22,2023-03-27T06:46:32.000Z,admin,2,2023-03-27T06:46:32.000Z,admin,2,Siêu Thị Suối Tiên - VITIMART,sieuthi_vdms_covid19.xlsx,,"Quốc Lộ 52, Phường Tân Phú, Quận 9, Thành Phố Hồ Chí Minh",Quận 9,,"{""type"":""Point"",""coordinates"":[106.803144,10.866977]}",Siêu Thị Suối Tiên - VITIMART
252f8bef-ea3b-4f3a-b065-20914f515268,ICTHCM_HCM_SIEUTHI,/root/vdms/tangthu/data/gisp/icthcm/customdata/icthcm_hcm_sieuthi/059c1f19-e289-4547-a28d-f8458179931c,2023-03-27T06:46:36.000Z,admin,2,2023-03-27T06:46:36.000Z,admin,2,Siêu Thị VinMart,sieuthi_vdms_covid19.xlsx,18006968,"Đường Số 48, Phường 3, Quận 4, Thành Phố Hồ Chí Minh",Quận 4,,"{""type"":""Point"",""coordinates"":[106.70033,10.756353]}",Siêu Thị VinMart
fdce95ad-2266-4d54-b7ad-9bea1288d5c9,ICTHCM_HCM_SIEUTHI,/root/vdms/tangthu/data/gisp/icthcm/customdata/icthcm_hcm_sieuthi/4d22452d-2769-4aa9-a67f-f39c5054f1fa,2023-03-27T06:46:37.000Z,admin,2,2023-03-27T06:46:37.000Z,admin,2,Siêu Thị Fivimart,sieuthi_vdms_covid19.xlsx,54110102-54110106,"Thiên Sơn Plaza, 800 Đường Nguyễn Văn Linh, Phường Tân Phú, Quận 7, Thành Phố Hồ Chí Minh",Quận 7,,"{""type"":""Point"",""coordinates"":[106.719432,10.731529]}",Siêu Thị Fivimart
b14af9d8-ed73-4524-a117-0f27bc9e4326,ICTHCM_HCM_SIEUTHI,/root/vdms/tangthu/data/gisp/icthcm/customdata/icthcm_hcm_sieuthi/f9d68984-e7e8-424a-8d49-6e537a1eb6b1,2023-03-27T06:46:43.000Z,admin,2,2023-03-27T06:46:43.000Z,admin,2,Bách Hóa Xanh,sieuthi_vdms_covid19.xlsx,,"29 Đường Ao Đôi, Phường Bình Trị Đông A, Quận Bình Tân, Thành Phố Hồ Chí Minh",Quận Bình Tân,,"{""type"":""Point"",""coordinates"":[106.599499,10.774317]}",Bách Hóa Xanh
a60487c1-5fc3-4624-a42c-c63bc1cef9c8,ICTHCM_HCM_SIEUTHI,/root/vdms/tangthu/data/gisp/icthcm/customdata/icthcm_hcm_sieuthi/041bfbd9-248f-4655-b992-62eae6f925e2,2023-03-27T06:44:36.000Z,admin,2,2023-03-27T06:44:36.000Z,admin,2,Siêu Thị CO.OP Mart,sieuthi_vdms_covid19.xlsx,,"974A Đường Trường Sa, Phường 12, Quận 3, Thành Phố Hồ Chí Minh",Quận 3,,"{""type"":""Point"",""coordinates"":[106.6754,10.786351]}",Siêu Thị CO.OP Mart
6859fd28-740b-4231-9dfd-456712e08489,ICTHCM_HCM_SIEUTHI,/root/vdms/tangthu/data/gisp/icthcm/customdata/icthcm_hcm_sieuthi/5af91b3b-c9cb-4004-a81a-94360c4d55f9,2023-03-27T06:44:37.000Z,admin,2,2023-03-27T06:44:37.000Z,admin,2,VinMart,sieuthi_vdms_covid19.xlsx,,"602/12 (Số Cũ 569/12) Đường Điện Biên Phủ, Phường 22, Quận Bình Thạnh, Thành Phố Hồ Chí Minh",Quận Bình Thạnh,,"{""type"":""Point"",""coordinates"":[106.717805,10.798945]}",VinMart
da43c5db-4165-45d5-8bbd-401e2d542bdd,ICTHCM_HCM_SIEUTHI,/root/vdms/tangthu/data/gisp/icthcm/customdata/icthcm_hcm_sieuthi/0330a2fc-ab5d-443d-b817-8b8a1b4c6d52,2023-03-27T06:44:38.000Z,admin,2,2023-03-27T06:44:38.000Z,admin,2,Mega Market,sieuthi_vdms_covid19.xlsx,,"Đường Bình Phú, Phường 11, Quận 6, Thành Phố Hồ Chí Minh",Quận 6,,"{""type"":""Point"",""coordinates"":[106.630156,10.742247]}",Mega Market
b4e47cdb-3ee9-441b-80e0-f2dd7fdd86a7,ICTHCM_HCM_SIEUTHI,/root/vdms/tangthu/data/gisp/icthcm/customdata/icthcm_hcm_sieuthi/b0f9b730-f7b2-4b84-aa72-8330b2d72e2e,2023-03-27T06:44:38.000Z,admin,2,2023-03-27T06:44:38.000Z,admin,2,Chi Nhánh 2 Công Ty Trách Nhiệm Hữu Hạn Đinh Huy Hoàng - Siêu Thị Điện Máy Đinh Huy Hoàng,sieuthi_vdms_covid19.xlsx,,"41 Đường Nguyễn Thị Tú, Phường Bình Hưng Hòa B, Quận Bình Tân, Thành Phố Hồ Chí Minh",Quận Bình Tân,,"{""type"":""Point"",""coordinates"":[106.599331,10.815988]}",Chi Nhánh 2 Công Ty Trách Nhiệm Hữu Hạn Đinh Huy Hoàng - Siêu Thị Điện Máy Đinh Huy Hoàng
44e22219-9f9b-400d-90eb-3c4bb01be134,ICTHCM_HCM_SIEUTHI,/root/vdms/tangthu/data/gisp/icthcm/customdata/icthcm_hcm_sieuthi/0fd51c9b-3fa2-4f95-8b13-f0adadf1cd55,2023-03-27T06:44:40.000Z,admin,2,2023-03-27T06:44:40.000Z,admin,2,Siêu Thị Sách Nhân Văn,sieuthi_vdms_covid19.xlsx,62676517,"139 Đường Tân Hương, Phường Tân Quý, Quận Tân Phú, Thành Phố Hồ Chí Minh",Quận Tân Phú,,"{""type"":""Point"",""coordinates"":[106.624656,10.789664]}",Siêu Thị Sách Nhân Văn
f11790be-2187-4158-8868-8df6b26861d7,ICTHCM_HCM_SIEUTHI,/root/vdms/tangthu/data/gisp/icthcm/customdata/icthcm_hcm_sieuthi/6daeca7a-72df-4712-9bfd-3f0a1e823abe,2023-03-27T06:44:43.000Z,admin,2,2023-03-27T06:44:43.000Z,admin,2,FamilyMart,sieuthi_vdms_covid19.xlsx,,"Đường Điện Biên Phủ, Phường 17, Quận Bình Thạnh, Thành Phố Hồ Chí Minh",Quận Bình Thạnh,,"{""type"":""Point"",""coordinates"":[106.70717,10.799709]}",FamilyMart
626b4b69-bf37-4914-9b28-cbb7c3ff4d00,ICTHCM_HCM_SIEUTHI,/root/vdms/tangthu/data/gisp/icthcm/customdata/icthcm_hcm_sieuthi/60bb1c8d-949a-4440-9a40-1db4b9877cac,2023-03-27T06:44:44.000Z,admin,2,2023-03-27T06:44:44.000Z,admin,2,Siêu Thị Co.op Mart,sieuthi_vdms_covid19.xlsx,,"Tòa nhà Pearl Plaza, 561A Đường Điện Biên Phủ, Phường 25, Quận Bình Thạnh, Thành Phố Hồ Chí Minh",Quận Bình Thạnh,,"{""type"":""Point"",""coordinates"":[106.718403,10.799626]}",Siêu Thị Co.op Mart
1049873a-05ec-46e9-a6cd-515301c170a2,ICTHCM_HCM_SIEUTHI,/root/vdms/tangthu/data/gisp/icthcm/customdata/icthcm_hcm_sieuthi/19cec3ac-ab9c-4996-a928-7b5878d2139d,2023-03-27T06:44:49.000Z,admin,2,2023-03-27T06:44:49.000Z,admin,2,Citimart,sieuthi_vdms_covid19.xlsx,,"ACM, 96 Đường Cao Thắng, Phường 4, Quận 3, Thành Phố Hồ Chí Minh",Quận 3,,"{""type"":""Point"",""coordinates"":[106.680669,10.771358]}",Citimart
8ca0f7a9-45da-4ed1-9b17-9456df0e4f70,ICTHCM_HCM_SIEUTHI,/root/vdms/tangthu/data/gisp/icthcm/customdata/icthcm_hcm_sieuthi/64212bfe-9821-41f1-bd3b-1220765ea36c,2023-03-27T06:44:49.000Z,admin,2,2023-03-27T06:44:49.000Z,admin,2,Siêu Thị Auchan (Cổng Trường Sơn),sieuthi_vdms_covid19.xlsx,39778890,"11 Đường Trường Sơn, Phường 15, Quận 10, Thành Phố Hồ Chí Minh",Quận 10,,"{""type"":""Point"",""coordinates"":[106.665612,10.783983]}",Siêu Thị Auchan (Cổng Trường Sơn)
3b059fac-b5ec-435c-affc-48eb98b30cdf,ICTHCM_HCM_SIEUTHI,/root/vdms/tangthu/data/gisp/icthcm/customdata/icthcm_hcm_sieuthi/97d137e6-56fa-4105-85d0-63b969de88de,2023-03-27T06:44:35.000Z,admin,2,2023-03-27T06:44:35.000Z,admin,2,Siêu Thị Aeon Citimart,sieuthi_vdms_covid19.xlsx,,"21-23 Đường Nguyễn Thị Minh Khai, Phường Bến Nghé, Quận 1, Thành Phố Hồ Chí Minh",Quận 1,,"{""type"":""Point"",""coordinates"":[106.699507,10.784357]}",Siêu Thị Aeon Citimart
e57ad9d6-4646-42a5-b66d-11ef84bda74d,ICTHCM_HCM_SIEUTHI,/root/vdms/tangthu/data/gisp/icthcm/customdata/icthcm_hcm_sieuthi/c8823b5d-1710-4ff8-9acd-c99f8e165a02,2023-03-27T06:44:37.000Z,admin,2,2023-03-27T06:44:37.000Z,admin,2,Lotte Mart,sieuthi_vdms_covid19.xlsx,,"Đường Quách Văn Tuấn, Phường 12, Quận Tân Bình, Thành Phố Hồ Chí Minh",Quận Tân Bình,,"{""type"":""Point"",""coordinates"":[106.65264,10.800926]}",Lotte Mart
a712a8fb-0cfa-4b43-81d6-d1ff973f68e1,ICTHCM_HCM_SIEUTHI,/root/vdms/tangthu/data/gisp/icthcm/customdata/icthcm_hcm_sieuthi/c2f8c793-57e6-4b1a-a69f-cd5cd9581a9d,2023-03-27T06:44:37.000Z,admin,2,2023-03-27T06:44:37.000Z,admin,2,Siêu Thị Co.op Mart,sieuthi_vdms_covid19.xlsx,,"571-573 Đường Nguyễn Kiệm, Phường 9, Quận Phú Nhuận, Thành Phố Hồ Chí Minh",Quận Phú Nhuận,,"{""type"":""Point"",""coordinates"":[106.678439,10.80885]}",Siêu Thị Co.op Mart
8b0ee192-6ce2-4a44-a53c-6e159009bd63,ICTHCM_HCM_SIEUTHI,/root/vdms/tangthu/data/gisp/icthcm/customdata/icthcm_hcm_sieuthi/495f734b-d1a3-4f3b-9c68-fca9fdab2ad8,2023-03-27T06:44:40.000Z,admin,2,2023-03-27T06:44:40.000Z,admin,2,Siêu Thị Co.opMart (Cổng Nguyễn Đình Chiểu),sieuthi_vdms_covid19.xlsx,,"168 Đường Nguyễn Đình Chiểu, Phường 6, Quận 3, Thành Phố Hồ Chí Minh",Quận 3,,"{""type"":""Point"",""coordinates"":[106.692672818899,10.7813957678884]}",Siêu Thị Co.opMart (Cổng Nguyễn Đình Chiểu)
21e2eb1f-ddb3-4d25-818e-871002138e09,ICTHCM_HCM_SIEUTHI,/root/vdms/tangthu/data/gisp/icthcm/customdata/icthcm_hcm_sieuthi/110735c9-cbce-433c-934a-7afe5a9c5a89,2023-03-27T06:44:40.000Z,admin,2,2023-03-27T06:44:40.000Z,admin,2,Siêu Thị S.Mart,sieuthi_vdms_covid19.xlsx,,"520A Đường Lê Văn Sỹ, Phường 14, Quận 3, Thành Phố Hồ Chí Minh",Quận 3,,"{""type"":""Point"",""coordinates"":[106.674428301897,10.7898343779625]}",Siêu Thị S.Mart
43fef4a4-7ece-42c6-9d10-88c66f76fecf,ICTHCM_HCM_SIEUTHI,/root/vdms/tangthu/data/gisp/icthcm/customdata/icthcm_hcm_sieuthi/6559a54b-0b13-4ffa-b98a-ceb9f203598d,2023-03-27T06:44:41.000Z,admin,2,2023-03-27T06:44:41.000Z,admin,2,Siêu Thị Điện Máy Thiên Hòa,sieuthi_vdms_covid19.xlsx,,"Đường Cách Mạng Tháng Tám, Phường 12, Quận 10, Thành Phố Hồ Chí Minh",Quận 10,,"{""type"":""Point"",""coordinates"":[106.681143,10.778028]}",Siêu Thị Điện Máy Thiên Hòa
25a59b9d-5bbe-43ac-9a99-565fbe0b6e3e,ICTHCM_HCM_SIEUTHI,/root/vdms/tangthu/data/gisp/icthcm/customdata/icthcm_hcm_sieuthi/5ebdf6f4-9edc-45f5-95c0-bee376894497,2023-03-27T06:44:45.000Z,admin,2,2023-03-27T06:44:45.000Z,admin,2,Siêu Thị Auchan (Cổng Hồ Bá Kiện),sieuthi_vdms_covid19.xlsx,,"Đường Hồ Bá Kiện, Phường 15, Quận 10, Thành Phố Hồ Chí Minh",Quận 10,,"{""type"":""Point"",""coordinates"":[106.665704,10.783792]}",Siêu Thị Auchan (Cổng Hồ Bá Kiện)
5c685793-a222-4719-825e-5ae908c3aa73,ICTHCM_HCM_SIEUTHI,/root/vdms/tangthu/data/gisp/icthcm/customdata/icthcm_hcm_sieuthi/7c151089-bc9c-4b91-bb92-7b46f0667851,2023-03-27T06:45:11.000Z,admin,2,2023-03-27T06:45:11.000Z,admin,2,Siêu Thị Sài Gòn Parkland,sieuthi_vdms_covid19.xlsx,38989000,"628A Đường An Bình, Phường An Phú, Quận 2, Thành Phố Hồ Chí Minh",Quận 2,,"{""type"":""Point"",""coordinates"":[106.749698525147,10.8039482580897]}",Siêu Thị Sài Gòn Parkland
59b513d5-97f0-44d9-8551-acea1966e6de,ICTHCM_HCM_SIEUTHI,/root/vdms/tangthu/data/gisp/icthcm/customdata/icthcm_hcm_sieuthi/2d6f9c90-38cf-4371-b551-ce1663bb7e84,2023-03-27T06:45:12.000Z,admin,2,2023-03-27T06:45:12.000Z,admin,2,Bách Hóa Xanh,sieuthi_vdms_covid19.xlsx,,"Đường Tên Lửa, Phường Bình Trị Đông B, Quận Bình Tân, Thành Phố Hồ Chí Minh",Quận Bình Tân,,"{""type"":""Point"",""coordinates"":[106.606087,10.756626]}",Bách Hóa Xanh
760bd86e-6112-41df-a1d8-27c71f433d7d,ICTHCM_HCM_SIEUTHI,/root/vdms/tangthu/data/gisp/icthcm/customdata/icthcm_hcm_sieuthi/4c474f01-ca4d-40ab-be1f-7133fdd0598d,2023-03-27T06:45:12.000Z,admin,2,2023-03-27T06:45:12.000Z,admin,2,Siêu Thị Co.op Mart,sieuthi_vdms_covid19.xlsx,,"192 Đường Hậu Giang, Phường 6, Quận 6, Thành Phố Hồ Chí Minh",Quận 6,,"{""type"":""Point"",""coordinates"":[106.643096,10.74983]}",Siêu Thị Co.op Mart
cf80fb44-8fa6-4e90-a3b2-10cff4848bc3,ICTHCM_HCM_SIEUTHI,/root/vdms/tangthu/data/gisp/icthcm/customdata/icthcm_hcm_sieuthi/ace8e22c-b00f-4dbc-ac24-2f9fa52a01f7,2023-03-27T06:45:34.000Z,admin,2,2023-03-27T06:45:34.000Z,admin,2,Siêu Thị VinMart,sieuthi_vdms_covid19.xlsx,,"Đường Dương Đình Nghệ, Phường 8, Quận 11, Thành Phố Hồ Chí Minh",Quận 11,,"{""type"":""Point"",""coordinates"":[106.650126,10.762393]}",Siêu Thị VinMart
f20b178e-a87d-4602-b41f-79209e55cf7d,ICTHCM_HCM_SIEUTHI,/root/vdms/tangthu/data/gisp/icthcm/customdata/icthcm_hcm_sieuthi/f0574a49-50de-4849-971f-8fc4c179edfc,2023-03-27T06:45:53.000Z,admin,2,2023-03-27T06:45:53.000Z,admin,2,Siêu Thị 12g Mỹ Anh,sieuthi_vdms_covid19.xlsx,,"82 Đường Đoàn Hồng Phước, Phường Hòa Thạnh, Quận Tân Phú, Thành Phố Hồ Chí Minh",Quận Tân Phú,,"{""type"":""Point"",""coordinates"":[106.636322,10.777613]}",Siêu Thị 12g Mỹ Anh
d60daf1d-d7e5-4ee1-8c30-d261a282533d,ICTHCM_HCM_SIEUTHI,/root/vdms/tangthu/data/gisp/icthcm/customdata/icthcm_hcm_sieuthi/7e60c731-b89b-4ade-a9e4-0cbb3e6c2df8,2023-03-27T06:45:54.000Z,admin,2,2023-03-27T06:45:54.000Z,admin,2,Công Ty Trách Nhiệm Hữu Hạn B-S Mart,sieuthi_vdms_covid19.xlsx,,"53 Đường Lê Thúc Hoạch, Phường Phú Thọ Hòa, Quận Tân Phú, Thành Phố Hồ Chí Minh",Quận Tân Phú,,"{""type"":""Point"",""coordinates"":[106.624419,10.786859]}",Công Ty Trách Nhiệm Hữu Hạn B-S Mart
74108250-318f-4bf4-8d1f-ba1c6f09a86f,ICTHCM_HCM_SIEUTHI,/root/vdms/tangthu/data/gisp/icthcm/customdata/icthcm_hcm_sieuthi/31d77dce-4312-448d-a96a-349b1b051aed,2023-03-27T06:45:54.000Z,admin,2,2023-03-27T06:45:54.000Z,admin,2,Satra Mart - Siêu Thi Tax,sieuthi_vdms_covid19.xlsx,,"Lucky Plaza, 38 Đường Nguyễn Huệ, Phường Bến Nghé, Quận 1, Thành Phố Hồ Chí Minh",Quận 1,,"{""type"":""Point"",""coordinates"":[106.704307,10.773779]}",Satra Mart - Siêu Thi Tax
015616d3-94f2-4fd8-b906-0cf8739641ec,ICTHCM_HCM_SIEUTHI,/root/vdms/tangthu/data/gisp/icthcm/customdata/icthcm_hcm_sieuthi/470beeec-f245-471d-ab5e-73222bd520ec,2023-03-27T06:46:04.000Z,admin,2,2023-03-27T06:46:04.000Z,admin,2,Siêu Thị Titan I,sieuthi_vdms_covid19.xlsx,37583817,"A30/16 Đường Phạm Hùng, Phường 4, Quận 8, Thành Phố Hồ Chí Minh",Quận 8,,"{""type"":""Point"",""coordinates"":[106.669828444719,10.7389899371233]}",Siêu Thị Titan I
6cb4363d-ce2e-4787-9b48-fdf884540e60,ICTHCM_HCM_SIEUTHI,/root/vdms/tangthu/data/gisp/icthcm/customdata/icthcm_hcm_sieuthi/201f4f65-37f9-4dcc-9725-e4efc54e191c,2023-03-27T06:46:05.000Z,admin,2,2023-03-27T06:46:05.000Z,admin,2,Siêu Thị Văn Hóa Phước Bình,sieuthi_vdms_covid19.xlsx,,"57K Đường Đại Lộ 2, Phường Phước Bình, Quận 9, Thành Phố Hồ Chí Minh",Quận 9,,"{""type"":""Point"",""coordinates"":[106.770786,10.817129]}",Siêu Thị Văn Hóa Phước Bình
2ff1d6b7-dad9-45a7-8371-a4031f152cf1,ICTHCM_HCM_SIEUTHI,/root/vdms/tangthu/data/gisp/icthcm/customdata/icthcm_hcm_sieuthi/1dedf1ad-779e-4148-b503-e908bd9fd567,2023-03-27T06:46:06.000Z,admin,2,2023-03-27T06:46:06.000Z,admin,2,Akuruhi Supermarket,sieuthi_vdms_covid19.xlsx,,"5 Đường Lê Thánh Tôn, Phường Bến Nghé, Quận 1, Thành Phố Hồ Chí Minh",Quận 1,,"{""type"":""Point"",""coordinates"":[106.705748,10.781728]}",Akuruhi Supermarket
af8d7eeb-3fe6-4afe-95b3-cccd171b4a7d,ICTHCM_HCM_SIEUTHI,/root/vdms/tangthu/data/gisp/icthcm/customdata/icthcm_hcm_sieuthi/9f058c06-1e97-463e-9cbf-6d673ce37e94,2023-03-27T06:46:13.000Z,admin,2,2023-03-27T06:46:13.000Z,admin,2,Siêu Thị Vật Liệu Xây Nhà,sieuthi_vdms_covid19.xlsx,,"112 Đường Số 7, Phường Bình Trị Đông B, Quận Bình Tân, Thành Phố Hồ Chí Minh",Quận Bình Tân,,"{""type"":""Point"",""coordinates"":[106.613389,10.751913]}",Siêu Thị Vật Liệu Xây Nhà
66882688-b0ee-4e86-9b48-57b0513e4573,ICTHCM_HCM_SIEUTHI,/root/vdms/tangthu/data/gisp/icthcm/customdata/icthcm_hcm_sieuthi/e1d25679-500e-460e-8932-64b13556a72a,2023-03-27T06:46:15.000Z,admin,2,2023-03-27T06:46:15.000Z,admin,2,Siêu Thị 7 Map,sieuthi_vdms_covid19.xlsx,,"442 Đường Kinh Dương Vương, Phường An Lạc A, Quận Bình Tân, Thành Phố Hồ Chí Minh",Quận Bình Tân,,"{""type"":""Point"",""coordinates"":[106.617413,10.740592]}",Siêu Thị 7 Map
5284427d-0e94-4eaa-a416-4e6e300c4787,ICTHCM_HCM_SIEUTHI,/root/vdms/tangthu/data/gisp/icthcm/customdata/icthcm_hcm_sieuthi/14e26a11-52f1-4f34-b8b8-9e78ad6909aa,2023-03-27T06:46:15.000Z,admin,2,2023-03-27T06:46:15.000Z,admin,2,Satra Mart,sieuthi_vdms_covid19.xlsx,,"2 Đường Lê Thị Riêng, Phường Bến Thành, Quận 1, Thành Phố Hồ Chí Minh",Quận 1,,"{""type"":""Point"",""coordinates"":[106.693073809147,10.7714226470526]}",Satra Mart
a8a19173-0b71-49b8-9c74-6fa765ded0d9,ICTHCM_HCM_SIEUTHI,/root/vdms/tangthu/data/gisp/icthcm/customdata/icthcm_hcm_sieuthi/afff4ed4-c70b-4ccc-83d7-1a4782aa23d5,2023-03-27T06:46:20.000Z,admin,2,2023-03-27T06:46:20.000Z,admin,2,Siêu Thị Co.op Mart,sieuthi_vdms_covid19.xlsx,,"Đường Hùng Vương, Phường 9, Quận 5, Thành Phố Hồ Chí Minh",Quận 5,,"{""type"":""Point"",""coordinates"":[106.671534,10.759065]}",Siêu Thị Co.op Mart
bbb2405c-11e9-4da4-bde3-7bcd7e5217c0,ICTHCM_HCM_SIEUTHI,/root/vdms/tangthu/data/gisp/icthcm/customdata/icthcm_hcm_sieuthi/42598225-04cb-4b1f-8fb6-28d37b21cdb2,2023-03-27T06:46:22.000Z,admin,2,2023-03-27T06:46:22.000Z,admin,2,Siêu Thị Co.opMart Rạch Miễu,sieuthi_vdms_covid19.xlsx,35171368,"48 Lô C Đường Hoa Sứ, Phường 7, Quận Phú Nhuận, Thành Phố Hồ Chí Minh",Quận Phú Nhuận,,"{""type"":""Point"",""coordinates"":[106.688915,10.798738]}",Siêu Thị Co.opMart Rạch Miễu
b6238a9e-03c8-430a-a2d0-a7cb0ee21347,ICTHCM_HCM_SIEUTHI,/root/vdms/tangthu/data/gisp/icthcm/customdata/icthcm_hcm_sieuthi/ae44851b-1c93-493d-b488-1341d5c7130c,2023-03-27T06:46:24.000Z,admin,2,2023-03-27T06:46:24.000Z,admin,2,Siêu Thị Nga,sieuthi_vdms_covid19.xlsx,0915233939,"213 Đường Nguyễn Cư Trinh, Phường Nguyễn Cư Trinh, Quận 1, Thành Phố Hồ Chí Minh",Quận 1,,"{""type"":""Point"",""coordinates"":[106.686672,10.762486]}",Siêu Thị Nga
